name,latitude,longitude
Regularized subspace n-gram model for phonotactic ivector extraction,48.831474,2.325558
Research Progress of RNN Language Model,48.698948,2.174679
Contextualized Perturbation for Textual Adversarial Attack,32.080036,118.74437
BioALBERT: A Simple and Effective Pre-trained Language Model for Biomedical Named Entity Recognition,42.06556,-87.68434
"POINTER: Constrained Progressive Text Generation via Insertion-based
  Generative Pre-training",51.529232,45.97968
Stochastic Context-Free Grammars for Island-Driven Probabilistic Parsing,28.006546,120.67172
The Turking Test: Can Language Models Understand Instructions?,32.9255,117.39
SlimIPL: Language-Model-Free Iterative Pseudo-Labeling,46.78091,-71.29981
EIGEN: Event Influence GENeration using Pre-trained Language Models.,-41.136906,-71.31726
Unsupervised Paraphrase Generation via Dynamic Blocking.,40.925278,29.154444
Multilingual Jointly Trained Acoustic and Written Word Embeddings,31.205221,121.523674
Do We Really Need That Many Parameters In Transformer For Extractive Summarization? Discourse Can Help !,45.37203,9.169487
Improving Sequence Modeling Ability of Recurrent Neural Networks via Sememes,51.567093,-1.784602
Online Back-Parsing for AMR-to-Text Generation,35.612144,-82.56337
DagoBERT: Generating Derivational Morphology with a Pretrained Language Model,44.19442,28.650644
Cross-Thought for Sentence Encoder Pre-training,48.84716,2.35752
Tracking Naturalistic Linguistic Predictions with Deep Neural Language Models,47.311752,5.070194
Learning Sparse Prototypes for Text Generation,34.420143,73.24873
GLGE: A New General Language Generation Evaluation Benchmark,13.731389,100.53555
From Universal Language Model to Downstream Task: Improving RoBERTa-Based Vietnamese Hate Speech Detection,45.7856,4.768471
Complaint Identification in Social Media with Transformer Networks,23.036112,72.54639
Do Neural Language Models Overcome Reporting Bias?,-34.61447,-58.36564
TableGPT: Few-shot Table-to-Text Generation with Table Structure Reconstruction and Content Matching,48.11698,-1.641201
Generate Natural Language Explanations for Recommendation,4.1532,9.2923
Natural Language Generation Using Deep Learning to Support MOOC Learners,43.2594,-79.9175
Parameter Efficient Multimodal Transformers for Video Representation Learning,39.445244,-76.156715
Audio Captioning Based on Combined Audio and Semantic Embeddings,41.108368,16.883572
SJ_AJ@DravidianLangTech-EACL2021: Task-Adaptive Pre-Training of Multilingual BERT models for Offensive Language Identification,29.42351,-98.50063
Pauses for Detection of Alzheimer¡¯s Disease,32.79265,34.9862
Natural language understanding for argumentative dialogue systems in the opinion building domain,50.810112,19.11634
Multilingual Autoregressive Entity Linking,48.579456,7.76466
Multimodal Embeddings From Language Models for Emotion Recognition in the Wild,59.438686,24.771645
Advancing RNN Transducer Technology for Speech Recognition,32.65889,-16.924444
Moral Injury and the Absurd: The suffering of moral paradox,43.5258,1.508529
Arabic Named Entity Recognition: A BERT-BGRU Approach,38.94408,-77.321304
Few-Shot Keyword Spotting in Any Language,-31.536987,-68.5206
Pushing the Limits of Non-Autoregressive Speech Recognition,34.087032,49.641212
One Chatbot Per Person: Creating Personalized Chatbots based on Implicit User Profiles,41.740894,-74.082054
"Back to Square One: Bias Detection, Training and Commonsense Disentanglement in the Winograd Schema",45.644943,13.774184
Mixture of Informed Experts for Multilingual Speech Recognition,43.561214,1.469508
Comparing Approaches to Dravidian Language Identification,21.153854,-101.704544
"Visually Grounded Models of Spoken Language: A Survey of Datasets, Architectures and Evaluation Techniques",30.517782,103.87838
Light Attention Predicts Protein Location from the Language of Life,30.74985,104.11392
Transformer-Transducers for Code-Switched Speech Recognition,57.15594,-2.084096
RNN Transducer Models for Spoken Language Understanding,54.552,-1.214
St-Bert: Cross-Modal Language Model Pre-Training for End-to-End Spoken Language Understanding,-36.7986,-73.05674
Evaluation of Deep Learning Models for Hostility Detection in Hindi Text,51.412395,21.959229
Bayesian Transformer Language Models for Speech Recognition,50.923866,6.916878
Exploiting Adapters for Cross-Lingual Low-Resource Speech Recognition,49.884445,-97.125
"BioM-Transformers: Building Large Biomedical Language Models with BERT, ALBERT and ELECTRA",39.933083,32.857265
Code-Mixing on Sesame Street: Dawn of the Adversarial Polyglots,34.76095,135.6266
LoRA: Low-Rank Adaptation of Large Language Models.,21.934029,101.25299
"Charformer: Fast Character Transformers via Gradient-based Subword
  Tokenization",51.3072,12.433329
Lower Perplexity is Not Always Human-Like,41.601715,-93.658066
Sentiment Analysis Using XLM-R Transformer and Zero-shot Transfer Learning on Resource-poor Indian Language,51.069893,-1.794783
Coarse "split and lump" bilingual language models for richer source information in SMT.,48.398094,11.711164
AVA: A Financial Service Chatbot Based on Deep Bidirectional Transformers,48.009205,7.834589
An n-gram Approach to Exploiting a Monolingual Corpus for Machine Translation,44.22427,-76.4926
Evaluating the Robustness of Neural Language Models to Input Perturbations,43.884457,125.332695
fBERT: A Neural Transformer for Identifying Offensive Content,47.235725,-1.555156
Dialogue State Tracking with a Language Model using Schema-Driven Prompting,36.04642,103.86981
StaResGRU-CNN with CMedLMs: A stacked residual GRU-CNN with pre-trained biomedical language models for predictive intelligence,34.004154,-84.5877
Transformer-based approach for joint handwriting and named entity recognition in historical document,-36.625507,-64.29334
Joint Unsupervised and Supervised Training for Multilingual ASR,54.901897,37.402996
MAD-G: Multilingual Adapter Generation for Efficient Cross-Lingual Transfer,10.995559,-74.79147
Context-dependent phone models and models adaptation for phonotactic language recognition,15.777859,74.46401
Comparing Improved Language Models for Sentence Retrieval inQuestion Answering,33.504692,-86.797585
A Plagiarism Detection System for Arabic Documents,31.476017,74.34228
A commentary of GPT-3 in MIT Technology Review 2021,40.116184,-88.24484
MF-BERT: Multimodal Fusion in Pre-Trained BERT for Sentiment Analysis,23.815437,90.42537
Employing BERT-DCNN with sentic knowledge base for social media sentiment analysis,31.26425,121.65245
Incorporating Dynamic Semantics into Pre-Trained Language Model for Aspect-based Sentiment Analysis,52.001316,5.910109
Path Language Modeling over Knowledge Graphsfor Explainable Recommendation,13.753036,100.491104
Massively Multilingual ASR: A Lifelong Learning Solution,28.894846,105.42526
Time-based language models,44.939186,-93.16797
"Photorealistic Text-to-Image Diffusion Models with Deep Language
  Understanding",27.573235,110.02305
A Trigram HMM-Based POS Tagger for Indian Languages,54.866005,37.20991
OntoNotes: Sense Pool Verification Using Google N-gram and Statistical Tests,29.507677,-98.47115
Robustness in Statistical Language Modeling: Review and Perspectives,34.702038,135.21356
More efficient clustering of n-grams for statistical language modeling,29.66359,106.596016
Spoken Language Identification for Indian Languages Using Split and Merge EM Algorithm,43.2968,5.372856
"Integrating MAP, marginals, and unsupervised language model adaptation",48.42471,-123.36528
A Weighted Boolean Model for Cross-Language Text Retrieval,45.55,-94.15
Articulatory feature-based pronunciation modeling,24.6916,92.7512
"Concerning a Psychodynamic Function of Perplexity, Confusion, Suspicion, and Related Mental States",22.55826,88.34921
Discriminative n-gram language modeling for Turkish,40.213505,-8.451979
Acquaintance: A Novel Vector-Space N-Gram Technique for Document Categorization.,30.263163,120.16571
Evaluation of n-Gram-Based Classification Approaches on Classical Music Corpora,40.345398,-74.616234
"Mining document, concept, and term associations for effective biomedical retrieval: introducing MeSH-enhanced retrieval models",32.039845,118.752235
Maximum Entropy Modeling: A Suitable Framework to Learn Context-Dependent Lexicon Models for Statistical Machine Translation,24.45077,118.08775
Classifying Unknown Proper Noun Phrases Without Context,-12.082854,-76.94567
A Question Answering System on Special Domain and the Implementation of Speech Interface,51.51624,-0.098028
A language space representation for speech recognition,60.008118,30.349365
Using Prosody in Fixed Stress Languages for Improvement of Speech Recognition,50.017838,14.466437
Corrections to A Cache-Based Language Model for Speech Recognition,52.9114,-1.5153
Supervised and unsupervised web-based language model domain adaptation,23.090008,113.27836
Modelling word-pair relations in a category-based language model,10.917826,76.98741
Evaluation of Text Clustering Algorithms with N-Gram-Based Document Fingerprints,28.544443,77.2725
Self Inconsistency or Mere Self Perplexity,56.326263,44.007786
An Empirical Study on Language Model Adaptation Using a Metric of Domain Similarity,55.67001,37.480427
Variable-length sequence language model for large vocabulary continuous dictation machine,41.8407,-71.91118
Improvement of the State Merging Rule on Noisy Data in Probabilistic Grammatical Inference,34.13567,74.80116
An Efficiently Focusing Large Vocabulary Language Model,41.373573,-73.51311
EM-based Hybrid Model for Bilingual Terminology Extraction from Comparable Corpora,38.983803,-77.02366
Statistical Language Models of Lithuanian Based on Word Clustering and Morphological Decomposition,51.521023,-0.127246
Language modeling with stochastic automata,40.01509,-105.272255
Introducing linguistic constraints into statistical language modeling,43.69259,1.492908
Data augmentation and language model adaptation,34.232838,108.892746
Stochastic Analysis of Structured Language Modeling,48.839226,2.586849
Cross-language acoustic adaptation for automatic speech recognition,26.751501,83.38691
A Bidirectional Recurrent Neural Language Model for Machine Translation,40.76505,-73.96005
Multi-stream statistical n-gram modeling with application to automatic language identification,38.24987,140.87651
Google Books N-gram Corpus used as a Grammar Checker,48.84468,2.343372
N-gram Based Approach for Opinion Mining of Punjabi Text,41.827152,12.471406
A Comparative Investigation of Morphological Language Modeling for the Languages of the European Union,52.512547,13.396019
Maximum-likelihood training of the PLCG-based language model,55.69541,-3.654588
Large-scale random forest language models for speech recognition,-19.680609,-51.200073
On the Contribution of MWE-based Features to a Readability Formula for French as a Foreign Language,37.974068,23.74581
Positional Language Models for Clinical Information Retrieval,51.41956,-0.95077
Language modelling for Turkish as an agglutinative language,4.638175,-74.06416
Analyzing and improving statistical language models for speech recognition,52.785244,4.674562
Exploiting Language Models to Classify Events from Twitter,47.38856,8.05988
Sentence parsing with weak grammatical constraints,31.95994,-111.59971
Augmenting words with linguistic information for n-gram language models,-5.077426,-42.82771
Spoken language identification by ergodic HMMS and its state sequences,41.387566,2.114629
The Peculiar Temporality of Violence: a Source of Perplexity about Social Power,59.944035,30.295465
Adaptable N-gram classification model for data leakage prevention,25.011936,121.4678
Direct posterior confidence for out-of-vocabulary spoken term detection,50.12697,14.384528
Improved inference and autotyping in EEG-based BCI typing systems,33.37752,120.205925
Utterance segmentation using combined approach based on Bi-directional N-gram and maximum entropy,18.392698,-66.07469
Designing an extensible API for integrating language modeling and realization,23.036879,113.69855
The use and misuse of statistical tools,45.2072,5.69761
Language models for online handwritten Tamil word recognition,36.369595,127.36402
A Mandarin dictation machine based upon a hierarchical recognition approach and Chinese natural language analysis,39.126816,-77.21856
Bi-modal sentence structure for language modeling,44.82278,-0.607161
Latent semantic information in maximum entropy language models for conversational speech recognition,39.516064,-0.422265
"A Chinese efficient analyser integrating word segmentation, part-of-speech tagging, partial parsing and full parsing",36.832867,127.1781
"Inter-document similarities, language models, and ad hoc information retrieval",35.755737,51.468132
The Production of Finnish Nouns: A Psycholinguistically Motivated Connectionist Model,35.604797,140.1358
Phonotactic Diversity Predicts the Time Depth of the World¡¯s Language Families,38.039066,114.60362
Loquendo-Politecnico di Torino system for the 2009 NIST Language Recognition Evaluation,41.764896,123.448265
Topic Language Model Adaption for Recognition of Homologous Offline Handwritten Chinese Text Image,34.78436,-86.57342
Syntactic language modeling with formal grammars,22.593313,114.00253
Improving relevance feedback in language modeling with score regularization,40.97727,37.96903
A language modeling approach to entity recognition and disambiguation for search queries,42.339718,-71.100746
An hybrid language model for a continuous dictation prototype,7.593134,5.291785
Morpheme concatenation approach in language modeling for large-vocabulary Uyghur speech recognition,59.9668,10.732558
Bayesian recurrent neural network language model,25.620712,85.171745
Generating a dynamic hypertext environment with <i>n</i>-gram analysis,32.18872,34.88768
Statistical language modeling with a class-basedn-multigram model,40.968758,-72.24224
Semantic Characterization of Tweets Using Topic Models,52.215954,6.891588
Improved cross-task recognition using MMIE training,55.7812,37.7116
Within-word pronunciation variation modeling for Arabic ASRs: a direct data-driven approach,8.763486,77.64631
Error correction vs. query garbling for Arabic OCR document retrieval,29.725075,-95.66243
Phone sequence modeling with recurrent neural networks,36.35567,127.42082
Minimally supervised model of early language acquisition,35.018585,127.02659
Lazy execution of model-to-model transformations,-7.348831,108.222496
Optimizing query evaluation in n-gram indexing,44.355568,26.034286
Data Driven Approach for Language Model Adaptation using Stepwise Relative Entropy Minimization,52.102165,11.61169
"A Hierarchical Approach to Makam Classification of Turkish Makam Music, Using Symbolic Data",43.605377,1.431031
Cross-language retrieval using link-based language models,19.900412,75.3133
Semantics synchronous understanding for robust spoken language applications,38.73641,-9.140727
Acoustic and syntactical modeling in the ATROS system,38.339355,27.02431
Automatic Phrase Alignment: Using Statistical N-Gram Alignment for Syntactic Phrase Alignment,24.32658,116.12869
Entity-Based Local Coherence Modelling Using Topological Fields,17.511087,78.275475
Speeding Up Target-Language Driven Part-of-Speech Tagger Training for Machine Translation,22.668087,75.792755
Minimizing search errors due to delayed bigrams in real-time speech recognition systems,44.7646,20.467161
Portability of syntactic structure for language modeling,-2.616111,29.742779
Maximum entropy language modeling and the smoothing problem,35.576416,45.35991
Turkish word n-gram analyzing algorithms for a large scale Turkish corpus - TurCo,52.41319,9.794705
A study on n-gram indexing of musical features,33.483036,48.40896
Word association and MI-Trigger-based language modeling,30.27124,119.96515
LET'S DISCOH: COLLECTING AN ANNOTATED OPEN CORPUSWITH DIALOGUE ACTS AND REWARD SIGNALS FOR NATURAL LANGUAGE HELPDESKS,45.514515,-122.67702
Concept-based phrase spotting approach for spontaneous speech understanding,37.38625,-122.05134
The SSQ model of schizophrenic prodromal unfolding revised: An analysis of its causal chains based on the language of directed graphs,58.008495,56.24061
Chinese Keyword Extraction Based on N-Gram and Word Co-occurrence,-33.779587,151.10062
Language Models for Handwritten Short Message Services,29.991062,31.16595
Can RNNs reliably separate script and language at word and line level?,28.527468,77.15837
Evocative allusions in Matthew: Matthew 5:5 as a test case,23.139187,113.29938
Bayesian Subtree Alignment Model based on Dependency Trees,55.92224,-3.138872
A Bayesian Model for Generative Transition-based Dependency Parsing,33.81729,-118.038246
Natural language-based user interface for mobile devices with limited resources,35.70288,139.4436
Event tracking and text segmentation via hidden Markov models,47.361122,7.867154
Sentiment classification for Chinese reviews based on key substring features,12.934289,77.534325
Improvements on hierarchical language identification based on automatic language clustering,39.8394,-86.17006
Domain Adaptation of Maximum Entropy Language Models,41.747,-72.69
Composite background models and score standardization for language identification systems,43.714104,10.409105
Phrasal Segmentation Models for Statistical Machine Translation,6.467,3.183
Mandarin pronunciation modeling based on CASS corpus,35.489483,139.68355
Exact Sampling and Decoding in High-Order Hidden Markov Models,39.03143,-84.46426
Context-dependent hidden control neutral network architecture for continuous speech recognition,26.18789,-80.17095
Low Rank Language Models for Small Training Sets,43.63178,3.861833
Classifying pluricentric languages: Extending the monolingual model,33.278934,44.379124
Bootstrapping the Albanian Information Retrieval,28.879957,76.60853
Estimating Language Models Using Hadoop and Hbase,47.0185,28.8235
Using Prosodic Features in Language Models for Meetings,39.74387,116.33015
Phoneme-to-text transcription system with an infinite vocabulary,19.53183,-98.84613
Less is more,36.7232,3.1508
An N-Gram Topic Model for Time-Stamped Documents,40.784332,29.447487
Bilingually Motivated Word Segmentation for Statistical Machine Translation,44.461945,-93.15378
Skip-gram Language Modeling Using Sparse Non-negative Matrix Probability Estimation,23.140465,113.25619
Discriminative language modeling for speech recognition with relevance information,22.503647,88.36894
A 10000-word continuous-speech recognition system,51.525486,-0.132772
"Looking under Kachru's (1982, 1985) three circles model of World Englishes: the hidden reality and current challenges",-33.41672,-70.58356
Towards accurate recognition for children's oral reading fluency,35.66722,139.77722
Initial language models for spoken dialogue systems,30.663645,104.04095
Bloggers as experts,-37.808403,144.97632
Model-Driven Development of Context-aware Adaptive Learning Systems,36.70496,117.07982
Discriminative Vector for Spoken Language Recognition,45.75172,4.845139
The robustness of an almost-parsing language model given errorful training data,48.580833,7.763486
Representatively memorable,40.769943,-73.98259
Surprising parser actions and reading difficulty,43.783573,87.61374
iSentenizer: An incremental sentence boundary classifier,48.866768,2.35541
A decoder for large vocabulary continuous short message dictation on embedded devices,-23.315594,-51.154133
SALmon A Service Modeling Language and Monitoring Engine,49.21155,-0.3600656
A succinct N-gram language model,3.079247,101.73256
Context-Aware Correction of Spelling Errors in Hungarian Medical Documents,39.80781,-89.645386
Exploring Key Concept Paraphrasing Based on Pivot Language Translation for Question Retrieval,35.396744,116.5968
USZEGED: Correction Type-sensitive Normalization of English Tweets Using Efficiently Indexed n-gram Statistics,40.992043,28.797318
Applying Pairwise Ranked Optimisation to Improve the Interpolation of Translation Models,25.456093,118.98588
Data point selection for self-training,39.93907,116.11726
CodeX: Combining an SVM Classifier and Character N-gram Language Models for Sentiment Analysis on Twitter Text,40.441746,-3.687567
The IUCL+ System: Word-Level Language Identification via Extended Markov Models,31.186382,121.59172
A real-time American Sign Language word recognition system based on neural networks and a probabilistic model,42.300354,-71.26612
Boosted acoustic model learning and hypotheses rescoring on the CHiME-3 task,55.692608,12.097433
Training data pseudo-shuffling and direct decoding framework for recurrent neural network based acoustic modeling,41.50128,2.111507
Improving Document Relevancy Using Integrated Language Modeling Techniques,32.43028,-85.70778
Combining Continuous Word Representation and Prosodic Features for ASR Error Prediction,22.69268,75.87218
Discriminative pronunciation modeling for dialectal speech recognition,41.3852,2.194139
Multilingual Part-of-Speech Tagging with Bidirectional Long Short-Term Memory Models and Auxiliary Loss,41.96459,-86.35862
Using Weighted Model Averaging in Distributed Multilingual DNNs to Improve Low Resource ASR,34.716457,113.64419
The Labyrinth as Style in Pamphilia to Amphilanthus,50.20844,15.840664
Language modeling for mixed language speech recognition using weighted phrase extraction,37.69646,126.55119
Impairment of self-representation in schizophrenia: the roles of boundary articulation and self-reflexivity.,38.911682,-77.04424
Investigation on log-linear interpolation of multi-domain neural network language model,55.93139,-3.073056
CEA LIST's Participation at MediaEval 2013 Placing Task,35.745113,51.168777
A hierarchical framework for language identification,37.40358,127.16002
Ethical considerations regarding head transplantation,36.39919,127.39464
The Semantics of Death and Dying: Metaphor and Mortality,-23.633537,-46.62489
Doc2Sent2Vec,31.454853,74.29907
On the use of phone-gram units in recurrent neural networks for language identification,35.699722,139.74475
EMG: A Domain-Specific Transformation Language for Synthetic Model Generation,36.706287,48.507427
"Signs, gestures, and signs",18.624174,73.82125
What to do about non-standard (or non-canonical) language in NLP,19.302202,-98.24341
L2 processing as noisy channel language comprehension,42.364502,-71.0901
First Automatic Fongbe Continuous Speech Recognition System: Development of Acoustic Models and Language Models,55.79838,37.806072
EDA-gram: Designing electrodermal activity fingerprints for visualization and feature extraction,53.920834,27.592777
Context-independent acoustic models for thai speech recognition,48.66583,6.15972
"Statistical Learning, Inductive Bias, and Bayesian Inference in Language Acquisition",56.477066,85.04963
Features for Factored Language Models for Code-Switching Speech,27.947157,-82.465355
Chinese Preposition Selection for Grammatical Error Diagnosis,44.138325,-72.658936
Memory-Bounded Left-Corner Unsupervised Grammar Induction on Child-Directed Input,36.45781,115.97923
Hierarchical hybrid language models for open vocabulary continuous speech recognition using WFST.,5.360828,-0.633313
Weighted Neural Bag-of-n-grams Model: New Baselines for Text Classification.,-4.4200506,15.309558
Using the MGGI Methodology for Category-Based Language Modeling in Handwritten Marriage Licenses Books,39.86203,-75.34754
Dynamic adjustment of language models for automatic speech recognition using word similarity,36.399837,127.37514
Parallel Non-blocking Deterministic Algorithm for Online Topic Modeling,41.6498,-80.145
Statistical and comparative evaluation of various indexing and search models,44.146618,-93.998116
Multitask Learning with CTC and Segmental CRF for Speech Recognition,45.74214,4.894132
Advances in Fully-Automatic and Interactive Phrase-Based Statistical Machine Translation,33.656498,73.01538
Sequence-to-sequence prediction of personal computer software by recurrent neural network,41.842197,-71.46116
Deep Architectures for Neural Machine Translation,29.345497,105.943085
Continuous Chinese sign language recognition with CNN-LSTM,47.049507,8.312564
Twitter Language Identification Of Similar Languages And Dialects Without Ground Truth,39.035225,-76.98307
Finding and correcting syntax errors using recurrent neural networks,37.85346,112.55622
Context Selection for Embedding Models,51.3917,-2.391
Bridging the Native Language and Language Variety Identification Tasks,30.254768,120.1666
Sentence-Chain Based Seq2seq Model for Corpus Expansion,44.63679,10.943002
All-In-1 at IJCNLP-2017 Task 4: Short Text Classification with One Model for All Languages,48.84715,2.35737
Multi-task ensembles with teacher-student training,38.906483,-77.049324
Multi-Task Learning For Parsing The Alexa Meaning Representation Language,51.61801,-0.208963
Deep-FSMN for Large Vocabulary Continuous Speech Recognition,40.441467,-3.686246
"Regularizing RNNs for Caption Generation by Reconstructing The Past with
  The Present",3.113412,101.652626
Automatic Essay Scoring in E-learning System Using LSA Method with N-Gram Feature for Bahasa Indonesia,22.802,89.533
"Entrepreneurship, crisis, critique",30.66373,76.72716
"Guided Feature Transformation (GFT): A Neural Language Grounding Module
  for Embodied Agents",39.636868,2.648796
"A Comparison of Modeling Units in Sequence-to-Sequence Speech
  Recognition with the Transformer on Mandarin Chinese",60.01123,30.36825
Improve Neural Entity Recognition via Multi-Task Data Selection and Constrained Decoding,49.212654,-0.368468
Hierarchical Models for the Evolution of Compositional Language,39.922768,116.32317
Deep Lip Reading: a comparison of models and an online application,46.48753,30.731184
Modeling Non-Linguistic Contextual Signals in LSTM Language Models Via Domain Adaptation,48.84348,2.314088
Improved Chord Recognition by Combining Duration and Harmonic Language Models,45.191723,5.767062
