name,latitude,longitude
Learning Phrase Representations using RNN Encoder¨CDecoder for Statistical Machine Translation,42.278305,-83.73822
RoBERTa: A Robustly Optimized BERT Pretraining Approach,39.908115,116.250656
Recurrent neural network based language model,42.377052,-71.11665
Attention Is All You Need,43.661667,-79.395
Librispeech: An ASR corpus based on public domain audio books,47.655537,-122.30353
Student involvement: A developmental theory for higher education.,37.43,-122.17
XLNet: Generalized Autoregressive Pretraining for Language Understanding,35.713333,139.76222
Lisrel 8: Structural Equation Modeling With the Simplis Command Language,51.753437,-1.2540097
BioBERT: a pre-trained biomedical language representation model for biomedical text mining,37.87216,-122.258575
Universal Language Model Fine-tuning for Text Classification,48.826523,2.365553
GLUE: A Multi-Task Benchmark and Analysis Platform for Natural Language Understanding,39.952457,-75.19322
BERT: Pre-training of Deep Bidirectional Transformers for Language Understanding,52.204453,0.114908
Class-based n -gram models of natural language,40,-83.0145
Exploring the Limits of Transfer Learning with a Unified Text-to-Text Transformer,-23.563051,-46.730103
SpecAugment: A Simple Data Augmentation Method for Automatic Speech Recognition,34.072224,-118.4441
Communication-Efficient Learning of Deep Networks from Decentralized Data,40.8076,-73.96239
An empirical study of smoothing techniques for language modeling,41.302094,-72.93066
"ALBERT: A Lite BERT for Self-supervised Learning of Language
  Representations",39.328888,-76.62028
"Listen, attend and spell: A neural network for large vocabulary conversational speech recognition",43.076694,-89.41244
Estimation of probabilities from sparse data for the language model component of a speech recognizer,35.026157,135.77979
"Learning Phrase Representations using RNN Encoder-Decoder for
  Statistical Machine Translation",42.44851,-76.47862
Language Models are Few-Shot Learners,39.999584,116.32542
Unsupervised Cross-lingual Representation Learning at Scale,40.79845,-77.85993
"DistilBERT, a distilled version of BERT: smaller, faster, cheaper and lighter",49.260674,-123.24608
Extensions of recurrent neural network language model,42.35982,-71.09211
A comparison of event models for naive bayes text classification,29.643902,-82.35495
Improved backing-off for M-gram language modeling,40.10218,-88.227196
Building End-To-End Dialogue Systems Using Generative Hierarchical Neural Network Models,44.974194,-93.22776
LSTM neural networks for language modeling,51.52447,-0.1339817
Neural Architecture Search with Reinforcement Learning,51.4986,-0.175478
A study of smoothing methods for language models applied to information retrieval,32.881,-117.238
Automatic evaluation of summaries using N-gram co-occurrence statistics,-33.88858,151.1873
Transformers: State-of-the-Art Natural Language Processing,-37.797115,144.95998
Statistical Methods for Speech Recognition,31.201267,121.43278
SciBERT: A Pretrained Language Model for Scientific Text,30.263878,120.12342
A Decomposable Attention Model for Natural Language Inference,40.443504,-79.961525
From captions to visual concepts and back,37.7628,-122.45767
Google¡¯s Multilingual Neural Machine Translation System: Enabling Zero-Shot Translation,34.82229,135.52444
Dialogue Act Modeling for Automatic Tagging and Recognition of Conversational Speech,38.54,-121.75
Discriminative training and maximum entropy models for statistical machine translation,38.254166,140.87361
Adversarial Examples for Evaluating Reading Comprehension Systems,53.46705,-2.233884
"BART: Denoising Sequence-to-Sequence Pre-training for Natural Language Generation, Translation, and Comprehension",45.504166,-73.57472
LDA-based document models for ad-hoc retrieval,35.905163,-79.04694
A Maximum Entropy Model for Part-Of-Speech Tagging,30.28614,-97.73942
Topic modeling,42.3496,-71.0997
Recurrent Continuous Translation Models,34.02051,-118.28563
Rapid method for distinction of gram-negative from gram-positive bacteria,41.78885,-87.5987
N-gram-based text categorization,39.000443,-77.102394
A Study of Smoothing Methods for Language Models Applied to Ad Hoc Information Retrieval,39.909058,116.25057
Don¡¯t Stop Pretraining: Adapt Language Models to Domains and Tasks,-27.495964,153.00963
End-to-end attention-based large vocabulary speech recognition,53.52378,-113.52907
What Does BERT Look at? An Analysis of BERT¡¯s Attention,1.295556,103.776665
Towards End-To-End Speech Recognition with Recurrent Neural Networks,40.73,-73.995
ViLBERT: Pretraining Task-Agnostic Visiolinguistic Representations for Vision-and-Language Tasks,32.232246,-110.953545
Character-Aware Neural Language Models,-33.917732,151.23096
State-of-the-Art Speech Recognition with Sequence-to-Sequence Models,50.58329,5.559053
A Primer on Neural Network Models for Natural Language Processing,-37.9083,145.138
A program for aligning sentences in bilingual corpora,50.878162,4.700263
A theoretically grounded application of dropout in recurrent neural networks,55.944897,-3.189284
Relevance-Based Language Models,33.626534,130.42465
Model-based feedback in the language modeling approach to information retrieval,40.740875,-74.1739
Neural Architecture Search with Reinforcement Learning,38.649033,-90.31085
PSORTb v.2.0: Expanded prediction of bacterial protein subcellular localization and insights gained from comparative proteome analysis,55.67972,12.5725
Publicly Available Clinical,36.003147,-78.926895
ERNIE: Enhanced Language Representation with Informative Entities,42.723,-84.481
Multi-Task Deep Neural Networks for Natural Language Understanding,41.90384,12.514438
Enhanced LSTM for Natural Language Inference,30.610369,-96.344055
VideoBERT: A Joint Model for Video and Language Representation Learning,42.05485,-87.67394
Two decades of statistical language modeling: where do we go from here?,37.460155,126.9519
The Curious Case of Neural Text Degeneration,42.362804,-71.068634
Generating Text with Recurrent Neural Networks,39.987152,116.305855
Contextual String Embeddings for Sequence Labeling,38.983047,-76.941864
Exploring the limits of language modeling,19.322817,-99.18663
Exploring the Limits of Transfer Learning with a Unified Text-to-Text Transformer,59.34802,18.022285
Language modeling with gated convolutional networks,30.508183,114.41474
End-To-End Memory Networks,51.511417,-0.116727
Assessing the Ability of LSTMs to Learn Syntax-Sensitive Dependencies,40.76496,-111.84215
Sequence Level Training with Recurrent Neural Networks,33.792786,-84.32401
Language Models as Knowledge Bases?,35.15472,136.96695
SuperGLUE: A Stickier Benchmark for General-Purpose Language Understanding Systems,55.713203,13.193537
GLUE: A Multi-Task Benchmark and Analysis Platform for Natural Language Understanding,55.710793,37.577812
Predicting query performance,32.113388,34.802155
What Does BERT Learn about the Structure of Language?,45.46099,9.194592
TinyBERT: Distilling BERT for Natural Language Understanding,42.02496,-93.64955
A maximum entropy approach to adaptive statistical language modelling,45.746998,126.63069
LSTM recurrent networks learn simple context-free and context-sensitive languages,42.3356,-71.106415
Improved Inference for Unlexicalized Parsing,33.775887,-84.39629
XLNet: Generalized Autoregressive Pretraining for Language Understanding,52.450558,-1.930556
Unified Language Model Pre-training for Natural Language Understanding and Generation,48.148056,11.568056
Three new graphical models for statistical language modelling,44.49389,11.342778
End-to-end memory networks,40.42395,-86.9212
Applications of stochastic context-free grammars using the Inside-Outside algorithm,40.344234,-74.65147
Using the Output Embedding to Improve Language Models,45.406387,11.877446
A Scalable Hierarchical Distributed Language Model,31.297712,121.50361
Unsupervised Machine Translation Using Monolingual Corpora Only,52.355793,4.954782
Linguistic Knowledge and Transferability of Contextual Representations,41.662952,-91.554924
Learning Word Vectors for 157 Languages,51.0775,-114.13306
Continuous space language models,51.45639,-2.604444
MASS: Masked Sequence to Sequence Pre-training for Language Generation,38.035,-78.505
An Empirical Study of Smoothing Techniques for Language Modeling,60.17251,24.950956
How to Fine-Tune BERT for Text Classification?,43.07818,141.33997
Hierarchical Probabilistic Neural Network Language Model.,33.417194,-111.93651
Context dependent recurrent neural network language model,22.419722,114.206795
A cache-based natural language model for speech recognition,1.344722,103.68139
One Billion Word Benchmark for Measuring Progress in Statistical Language Modeling,-22.816828,-47.06974
Natural Language Object Retrieval,47.37581,8.546482
Federated Learning of Deep Networks using Model Averaging,35.784386,-78.682785
Language Models are Few-Shot Learners,52.93807,-1.196703
JUPlTER: a telephone-based conversational interface for weather information,33.64535,-117.84264
Pointer Sentinel Mixture Models,53.80722,-1.551667
Ask me anything: dynamic memory networks for natural language processing,41.50442,-81.60838
Twitter Sentiment Analysis with Deep Convolutional Neural Networks,53.38139,-1.488272
Understanding Natural Language Commands for Robotic Navigation and Mobile Manipulation,-22.8172,-47.0694
Unsupervised Learning of Sentence Embeddings Using Compositional n-Gram Features,52.090164,5.122601
Intelligent Selection of Language Model Training Data,55.872307,-4.288221
The Writing of History,50.93463,-1.39595
Fast Abstractive Summarization with Reinforce-Selected Sentence Rewriting,34.247223,108.979164
A bit of progress in language modeling,59.85105,17.629967
Semi-supervised sequence tagging with bidirectional language models,55.703934,37.52867
Programming With Models: Writing Statistical Algorithms for General Model Structures With NIMBLE,37.566032,126.93854
"Document language models, query models, and risk minimization for information retrieval",36.144936,-86.80269
A hierarchical Bayesian language model based on Pitman-Yor processes,35.60528,139.68259
An overview of the SPHINX speech recognition system,41.386665,2.163889
Neural Probabilistic Language Models,43.263332,-79.91889
An empirical study of smoothing techniques for language modeling,39.17106,-86.51388
Meshed-Memory Transformer for Image Captioning,29.70706,-95.39697
Phrase-Based &amp; Neural Unsupervised Machine Translation,-35.2778,149.1205
CTRL: A Conditional Transformer Language Model for Controllable Generation,25.016,121.536
Cluster-based retrieval using language models,47.374535,8.55097
Prosody-based automatic segmentation of speech into sentences and topics,37.22001,-80.42409
A Critical Review of Recurrent Neural Networks for Sequence Learning,31.822645,117.2807
Outrageously Large Neural Networks: The Sparsely-Gated Mixture-of-Experts Layer,51.046764,3.727875
Automatic speech recognition and speech variability: A review,59.93957,10.719175
Strategies for training large scale neural network language models,45.505554,-73.61548
"Document Language Models, Query Models, and Risk Minimization for Information Retrieval",29.711039,-95.39631
Advances in Pre-Training Distributed Word Representations,48.15068,11.580272
Knowledge Enhanced Contextual Word Representations,36.67361,117.05389
From Feedforward to Recurrent LSTM Neural Networks for Language Modeling,30.63016,104.09001
A Comparative Study on Transformer vs RNN in Speech Applications,53.406116,-2.965604
Twitter brand sentiment analysis: A hybrid system using n-gram analysis and dynamic artificial neural network,32.05611,118.775
USING A STATISTICAL LANGUAGE MODEL TO IMPROVE THE PERFORMANCE OF AN HMM-BASED CURSIVE HANDWRITING RECOGNITION SYSTEM,45.4222,-75.6824
Unified Vision-Language Pre-Training for Image Captioning and VQA,52.002792,4.370898
VisualBERT: A Simple and Performant Baseline for Vision and Language,40.44332,-79.94358
Multilingual Denoising Pre-training for Neural Machine Translation,-30.032438,-51.219315
A maximum entropy approach to identifying sentence boundaries,56.16816,10.20298
Topic and Role Discovery in Social Networks with Experiments on Enron and Academic Email,34.138577,-118.125496
Fully Character-Level Neural Machine Translation without Explicit Segmentation,-22.953331,-43.17429
Unsupervised Cross-lingual Representation Learning at Scale.,43.00984,-81.27376
How Multilingual is Multilingual BERT?,41.875305,-87.6579
Deep Captioning with Multimodal Recurrent Neural Networks (m-RNN),53.219444,6.562966
Pointer Sentinel Mixture Models,43.472534,-80.544876
The SPHINX-II speech recognition system: an overview,38.03099,-84.504486
Deep code search,31.281977,121.506195
Large Language Models in Machine Translation,23.0962,113.29806
Transfer Learning in Biomedical Natural Language Processing: An Evaluation of BERT and ELMo on Ten Benchmarking Datasets,48.141293,11.581925
Enriching Word Vectors with Subword Information,30.536316,114.36431
Efficient Neural Architecture Search via Parameter Sharing,25.71694,-80.27577
Commonsense Knowledge Aware Conversation Generation with Graph Attention,46.51908,6.566747
Character-Aware Neural Language Models,33.500675,-86.805824
Retrieval models for question and answer archives,39.111362,117.17482
Probabilistic Top-Down Parsing and Language Modeling,40.447872,-3.72863
Neural Belief Tracker: Data-Driven Dialogue State Tracking,48.213055,16.359722
Unicoder-VL: A Universal Encoder for Vision and Language by Cross-Modal Pre-Training,40.007366,-105.26526
Regularizing and Optimizing LSTM Language Models,50.78027,6.065655
Contextual Augmentation: Data Augmentation by Words with Paradigmatic Relations,31.794842,35.24138
Maximum entropy models for natural language ambiguity resolution,-31.980915,115.81988
From Complexity to Perplexity,50.73389,7.102222
The Goldilocks Principle: Reading Children's Books with Explicit Memory Representations,43.82497,125.28978
Passage Re-ranking with BERT,-34.593235,-58.39507
Generating Wikipedia by Summarizing Long Sequences,49.59788,11.004508
Neural Text Generation from Structured Data with Application to the Biography Domain,42.648064,-73.74959
DiSAN: Directional Self-Attention Network for RNN/CNN-Free Language Understanding,39.28636,-76.59014
ERNIE 2.0: A Continual Pre-Training Framework for Language Understanding,41.50028,2.107778
Edinburgh System Description for the 2005 IWSLT Speech Translation Evaluation,54.978,-1.615
Scalable Modified Kneser-Ney Language Model Estimation,41.384144,-81.71841
Transformer-XL: Attentive Language Models Beyond a Fixed-Length Context,44.02407,-92.46631
Very deep convolutional networks for end-to-end speech recognition,28.173,112.925
The Microsoft 2017 Conversational Speech Recognition System,-34.920654,138.60576
On the Cross-lingual Transferability of Monolingual Representations,43.129425,-77.62188
End-to-End Dense Video Captioning with Masked Transformer,48.525,9.059
What BERT Is Not: Lessons from a New Suite of Psycholinguistic Diagnostics for Language Models,52.52667,13.379722
Megatron-LM: Training Multi-Billion Parameter Language Models Using Model Parallelism,42.35936,-83.06657
Pre-Training With Whole Word Masking for Chinese BERT,40.84722,14.256944
Scaling Laws for Neural Language Models,36.11143,140.10384
Dissecting Contextual Word Embeddings: Architecture and Representation,39.98,116.340836
"Personal Projects Analysis: Trivial Pursuits, Magnificent Obsessions, and the Search for Coherence",38.93918,-92.331856
Character N-Gram Tokenization for European Language Text Retrieval,39.132023,-84.51555
Exposure-based models of human parsing: Evidence for the use of coarse-grained (nonlexical) statistical records,34.414227,-119.84912
ELECTRA: Pre-training Text Encoders as Discriminators Rather Than Generators,40.789085,-73.95311
Immediate-head parsing for language models,52.22143,21.014345
Sentence Encoders on STILTs: Supplementary Training on Intermediate Labeled-data Tasks,23.151306,113.34464
NeuroML: A Language for Describing Data Driven Models of Neurons and Networks with a High Degree of Biological Detail,35.875557,-106.324165
ScispaCy: Fast and Robust Models for Biomedical Natural Language Processing,52.45273,13.289647
Structured language modeling,-36.852303,174.76773
One billion word benchmark for measuring progress in statistical language modeling,46.95052,7.438109
Pay Less Attention with Lightweight and Dynamic Convolutions,32.055927,118.79425
On the State of the Art of Evaluation in Neural Language Models,41.8262,-71.4032
Automatic speech recognition : the development of the SPHINX system,41.807167,-72.2525
Silences and secrecy: The hidden agenda of cartography in early modern Europe,43.77788,11.259733
Improved statistical machine translation using paraphrases,-19.871904,-43.966248
The rise and fall of the biopsychosocial model,51.81901,5.856999
Models of Translational Equivalence among Words,37.875443,-122.24554
Neural Symbolic Machines: Learning Semantic Parsers on Freebase with Weak Supervision,57.698345,11.971846
CodeBERT: A Pre-Trained Model for Programming and Natural Languages,52.379436,-1.561502
Statistical language model adaptation: review and perspectives,47.99375,7.845918
K-BERT: Enabling Language Representation with Knowledge Graph,51.541,9.937379
Learning author-topic models from text corpora,35.95593,-83.930145
Offline recognition of unconstrained handwritten texts using HMMs and statistical language models,43.71643,10.398687
Multimodal Neural Language Models,50.0884,14.4037
CamemBERT: a Tasty French Language Model,34.24364,108.91378
langid.py: An Off-the-shelf Language Identification Tool,45.066666,7.689019
Spoken language understanding using long short-term memory neural networks,46.781097,-71.278175
Forest Rescoring: Faster Decoding with Integrated Language Models,35.933334,-84.316666
TransferTransfo: A Transfer Learning Approach for Neural Network Based Conversational Agents,41.895832,12.462636
Combining the language model and inference network approaches to retrieval,40.914223,-73.11623
HMM based online handwriting recognition,35.64954,139.74307
Discriminative models for information retrieval,41.844097,-71.43472
Reading level assessment using support vector machines and statistical language models,30.675713,104.10027
Placing flickr photos on a map,28.054562,-82.413055
A language model approach to keyphrase extraction,52.15669,4.485037
Probabilistic text structuring,38.753227,-9.156779
TINA: a natural language system for spoken language applications,51.02947,13.728975
ALBERT: A Lite BERT for Self-supervised Learning of Language Representations,32.7775,35.021667
Early diagenesis of organic matter in marine sediments: progress and perplexity,37.588223,126.99361
<i>N</i>-gram-based Machine Translation,40.57368,-105.086555
Regularizing and Optimizing LSTM Language Models,49.01185,8.416644
Malware classification with recurrent networks,39.95778,116.308334
Time-based language models,45.499397,-122.685905
Sequence Level Training with Recurrent Neural Networks,55.785797,12.521533
Fine-tuned Language Models for Text Classification.,36.00348,-78.935814
12-in-1: Multi-Task Vision and Language Representation Learning,51.52428,-0.040395
Towards a Human-like Open-Domain Chatbot,50.928055,6.928611
Deep Cocktail Network: Multi-source Unsupervised Domain Adaptation with Category Shift,40.764194,-73.9561
BLOG: probabilistic models with unknown objects,44.225502,-76.49516
Generating Sentences from a Continuous Space,50.1249,8.667763
The microsoft 2016 conversational speech recognition system,35.70347,51.3952
Tying Word Vectors and Word Classifiers: A Loss Framework for Language Modeling,39.479465,-0.364728
BERTweet: A pre-trained language model for English Tweets,51.963425,7.613398
Is it time to leave behind the Revised Hierarchical Model of bilingual language processing after fifteen years of service?,51.4877,-3.179
Modeling word burstiness using the Dirichlet distribution,41.146465,-8.615786
A Thousand Frames in Just a Few Words: Lingual Description of Videos through Latent Topics and Sparse Object Stitching,38.874443,121.53361
How Much Knowledge Can You Pack Into the Parameters of a Language Model?,43.001106,-78.78897
Improved Training of End-to-end Attention Models for Speech Recognition,37.968266,23.778343
Generating Sentences by Editing Prototypes,49.806892,-97.13834
A tree-based statistical language model for natural language speech recognition,-34.599724,-58.373055
Pooled Contextualized Embeddings for Named Entity Recognition,38.899975,-77.048645
Monolingual Machine Translation for Paraphrase Generation,42.389004,-72.52671
MobileBERT: a Compact Task-Agnostic BERT for Resource-Limited Devices,36.369644,127.36401
Deep Belief Networks using discriminative features for phone recognition,32.812183,-96.84017
Dependence language model for information retrieval,46.199657,6.145095
Reviewing automatic language identification,51.445854,7.261598
Gram-positive and Gram-negative protein subcellular localization by incorporating evolutionary-based descriptors into Chou?s general PseAAC,29.560259,106.45419
Detection of Online Fake News Using N-Gram Analysis and Machine Learning Techniques,42.40983,-71.12194
A spelling correction program based on a noisy channel model,39.004326,-77.10119
A hierarchical Dirichlet language model,34.38222,132.45805
Neural Architecture Optimization,30.413998,-91.18103
Domain-Specific Language Model Pretraining for Biomedical Natural Language Processing,44.563995,-123.279465
Long Short-Term Memory Based Recurrent Neural Network Architectures for Large Vocabulary Speech Recognition,-33.44332,-70.65058
Improving automatic source code summarization via deep reinforcement learning,59.34748,18.073526
Achieving Human Parity in Conversational Speech Recognition,52.517845,13.393355
Augmenting Naive Bayes Classifiers with Statistical Language Models,63.419445,10.4025
"GA, MR, FFNN, PNN and GMM based models for automatic text summarization",41.709167,-87.981995
Unsupervised Pretraining for Sequence to Sequence Learning,-33.9575,18.460556
Word Sense Disambiguation: A Unified Evaluation Framework and Empirical Comparison,48.863808,2.329205
N-Gram Similarity and Distance,59.365276,18.058332
CEDR,38.996944,-76.848335
Towards Better Decoding and Language Model Integration in Sequence to Sequence Models,24.723982,46.64584
QANet: Combining Local Convolution with Global Self-Attention for Reading Comprehension,43.293537,5.357944
Ethics and Perplexity,37.186577,-3.599948
Automated Phrase Mining from Massive Text Corpora,60.79644,11.063399
Making Monolingual Sentence Embeddings Multilingual using Knowledge Distillation,52.333942,4.865709
Are deep neural networks the best choice for modeling source code?,-35.27627,149.14612
WinoGrande: An Adversarial Winograd Schema Challenge at Scale,38.954586,-95.25585
Q-BERT: Hessian Based Ultra Low Precision Quantization of BERT,52.511944,13.326389
A New String-to-Dependency Machine Translation Algorithm with a Target Dependency Language Model,45.478863,9.228206
Recurrent neural networks for language understanding,30.0276,31.21014
BERT for Coreference Resolution: Baselines and Analysis,30.442247,-84.29918
Adaptive Statistical Language Modeling; A Maximum Entropy Approach,38.8885,-77.02999
Temporal Action Detection Using a Statistical Language Model,22.336422,114.17299
Machine Comprehension Using Match-LSTM and Answer Pointer,44.636833,-63.591686
Revisiting Pre-Trained Models for Chinese Natural Language Processing,40.824093,-96.700645
Headline generation based on statistical translation,39.982258,-75.154594
A neural probabilistic language model,40.63,22.958055
Bayesian unsupervised word segmentation with nested Pitman-Yor language modeling,46.732166,-117.15444
Reducing Gender Bias in Abusive Language Detection,46.343224,-119.27634
Combining Language and Vision with a Multimodal Skip-gram Model,35.69966,139.74298
Temporal Analysis of Language through Neural Language Models,40.852177,-73.84439
Learning Differentially Private Recurrent Language Models,35.748272,51.38122
Deeper Text Understanding for IR with Contextual Neural Language Modeling,39.021835,-77.1563
Big Bird: Transformers for Longer Sequences,51.915684,4.525846
n-Gram Statistics for Natural Language Understanding and Text Processing,37.590477,127.02679
Pivot language approach for phrase-based statistical machine translation,48.697758,2.175969
End-to-End Open-Domain Question Answering with,-27.60111,-48.52
Semi-supervised Multitask Learning for Sequence Labeling,-27.476833,153.0284
Unsupervised Part-of-Speech Tagging with Bilingual Graph-Based Projections,33.9975,-81.025276
Adversarial Examples for Evaluating Reading Comprehension Systems,24.437328,118.1003
Conformer: Convolution-augmented Transformer for Speech Recognition,29.720201,-95.34225
Leveraging Pre-trained Checkpoints for Sequence Generation Tasks,49.788055,9.935278
Entropy-based Pruning of Backoff Language Models,36.06024,140.1331
Comparative Study of CNN and RNN for Natural Language Processing,39.957222,116.3625
REALM: Retrieval-Augmented Language Model Pre-Training.,35.08389,-106.61861
Adaptive Importance Sampling to Accelerate Training of a Neural Probabilistic Language Model,52.621323,-1.124664
Sockeye: A Toolkit for Neural Machine Translation.,40.5453,-3.69611
Controlling Linguistic Style Aspects in Neural Language Generation,31.262192,34.80151
On Faithfulness and Factuality in Abstractive Summarization,45.810673,15.970097
ELECTRA: Pre-training Text Encoders as Discriminators Rather Than Generators,50.060833,19.932777
Word Embedding based Generalized Language Model for Information Retrieval,34.201694,-118.17167
Distributional Semantics Resources for Biomedical Text Processing,39.103928,117.17413
Breaking the Softmax Bottleneck: A High-Rank RNN Language Model,52.240276,21.019167
Improving Accuracy in Word Class Tagging through the Combination of Machine Learning Systems,50.737343,-3.535159
