name,latitude,longitude
Thinking ahead: spontaneous prediction in context as a keystone of language in humans and machines,29.557451,106.45656
The Tatoeba Translation Challenge ¨C Realistic Data Sets for Low Resource and Multilingual MT,45.655834,25.580557
Share or Not? Learning to Schedule Language-Specific Capacity for Multilingual Translation,39.727352,-104.991615
Deep Shallow Fusion for RNN-T Personalization,48.978653,14.448417
Improving RNN Transducer Based ASR with Auxiliary Tasks,34.03388,-4.980074
Arabic Fake News Detection: Comparative Study of Neural Networks and Transformer-Based Approaches,43.802776,11.282778
Lawformer: A pre-trained language model for Chinese legal long documents,43.72333,7.30167
Learning to Prompt for Vision-Language Models,30.653383,104.05713
An Investigation on Initialization Schemes for Multilayer Perceptron Training Using Multilingual Data and Their Effect on ASR Performance,34.004314,51.363716
Transformers4Rec: Bridging the Gap between NLP and Sequential / Session-Based Recommendation,51.23503,22.549387
MSRLM: a Scalable Language Modeling Toolkit,38.7481,-9.153464
Transliteration Using a Phrase-Based Statistical Machine Translation System to Re-Score the Output of a Joint Multigram Model,4.628112,-74.06552
Modeling northern and southern varieties of dutch for STT,58.1639,8.003429
Efficient Subsampling for Training Complex Language Models,3.066254,101.60094
Axiomatic Analysis of Translation Language Model for Information Retrieval,-31.634443,-60.705276
N-Gram Based Secure Similar Document Detection,47.5938,19.3612
Bootstrapping language models for dialogue systems,30.219492,120.02732
Extracting Mobile Behavioral Patterns with the Distant N-Gram Topic Model,50.350346,-3.577872
Computationals models of bilingual comprehension,24.85252,46.72359
Comparing Local and Sequential Models for Statistical Incremental Natural Language Understanding,29.083,-110.962
Using Statistical Translation Models for Bilingual IR,51.766857,14.326547
Exploiting Thread Structures to Improve Smoothing of Language Models for Forum Post Retrieval,35.225674,-80.84578
Conversion of recurrent neural network language models to weighted finite state transducers for automatic speech recognition,45.5738,-73.5778
A Study on Music Genre Classification Based on Universal Acoustic Models.,39.961437,116.36588
Scalable neural network based language identification from written text,52.415646,12.968931
Conceptualizing Student Models for ICALL,36.63331,114.50572
Recent improvements of the RWTH large vocabulary speech recognition system on spontaneous speech,53.424053,14.533994
A Statistical Approach for Text Processing in Virtual Humans,51.75442,-1.209335
The ICSI+ multilingual sentence segmentation system,43.621113,3.868056
Improved speaker adaption using text dependent spectral mappings,35.661755,139.70944
Fragments of Unconscious Experience,39.974926,116.427
A statistical method for extracting uninterrupted and interrupted collocations from very large corpora,36.81648,119.98573
SLONN: A Simulation Language for modeling of Neural Networks,46.762062,23.5836
N-gram analysis of 970 microbial organisms reveals presence of biological language models,32.10438,35.20908
Penicillinases from Gram-Positive and Gram-Negative Bacteria: A Thermodynamic Difference,47.82994,1.938281
Tagging and chunking with bigrams,12.935087,77.60607
Syllable language models for Mandarin speech recognition: Exploiting character language models,-7.687595,110.41312
Training connectionist models for the structured language model,36.090755,103.700806
A log-linear model with an n-gram reference distribution for accurate HPSG parsing,2.313907,102.32118
Using knowledge of misunderstandings to increase the robustness of spoken dialogue systems,41.525097,-70.671326
Incorporating revisiting behaviors into click models,41.040592,-85.24008
Acoustic and language modeling of human and nonhuman noises for human-to-human spontaneous speech recognition,40.861736,-74.19857
Predictive value of the four good prognostic features in DSM-III-R schizophreniform disorder,26.943241,80.939285
Topic identification in natural language dialogues using neural networks,-7.810239,110.32145
A class based language model for speech recognition,48.843887,2.343611
The LIMSI 2006 TC-STAR EPPS Transcription Systems,51.817924,5.857125
Latent dirichlet language model for speech recognition,25.294807,51.541237
An LVQ based reference model for speaker-adaptive speech recognition,40.892883,29.374866
A computational account of bilingual aphasia rehabilitation,50.8804,4.6955
Memory-based context-sensitive spelling correction at web scale,-33.034584,-71.594345
Automatic Word Decompounding for ASR in a Morphologically Rich Language: Application to Amharic,19.345575,-99.170334
Context-sensitive statistics for improved grammatical language models,17.980698,79.532906
A comparative study on various confidence measures in large vocabulary speech recognition,54.988,82.904
Classifying words for improved statistical language models,39.977215,116.387634
Hallucinated n-best lists for discriminative language modeling,41.841274,12.514198
Sequencegram: n-gram modeling of system calls for program based anomaly detection,36.077106,-79.76849
On Efficient Coupling of ASR and SMT for Speech Translation,50.892982,-1.394984
A finite-state approach to machine translation,50.633923,3.048937
Stochastic language models for speech recognition and understanding,37.65826,126.78685
Unsupervised language model adaptation via topic modeling based on named entity hypotheses,32.48161,-93.76063
Language-model optimization by mapping of corpora,40.83726,14.253195
A Chinese OCR spelling check approach based on statistical language models,39.810097,-89.65765
Is the End of Supervised Parsing in Sight,55.756294,37.611294
Approximate matching of hierarchical data using pq -grams,-29.154514,-51.154617
TINA: a probabilistic syntactic parser for speech understanding systems,31.216467,121.42028
Prosodic and temporal features for language modeling for dialog,51.377388,7.494663
Discriminative Training of the Hidden Vector State Model for Semantic Parsing,38.984863,-77.09506
The Open University at TREC 2006 Enterprise Track Expert Search Task,39.71092,-75.11844
Building class-based language models with contextual statistics,48.835007,2.335303
Efficient and effective KNN sequence search with approximate n-grams,33.970364,-118.417404
Improved Spelling Error Detection and Correction for Arabic,-7.208693,-35.906544
Dependency Language Models for Sentence Completion,35.679123,139.76054
Recurrent neural network language model for English-Indonesian Machine Translation: Experimental study,24.89205,67.07352
Multilingual multilayer perceptron for rapid language adaptation between and across language families,43.136112,6.019444
Vocabulary and language model adaptation using information retrieval,51.763805,-1.21875
LSTM-Based System-Call Language Modeling and Robust Ensemble Method for Designing Host-Based Intrusion Detection Systems.,42.29528,-71.30667
The Regression Model of Machine Translation,23.054737,113.40527
"Can Prosody Aid the Automatic Processing of Multi-Party Meetings? Evidence from Predicting Punctuation, Disfluencies, and Overlapping Speech",42.42311,-76.49521
Towards Quantum Language Models,34.0668,-106.9056
Automatic Essay Scoring System Using N-Gram and Cosine Similarity for Gamification Based E-Learning,45.195965,5.704452
Compressing Word Embeddings via Deep Compositional Code Learning,52.211502,10.531487
"Wonder, appreciation, and the value of art",40.7393,-73.9753
Automatic Arabic Image Captioning using RNN-LSTM-Based Language Model and CNN,23.55052,87.290726
Neural Machine Translation Incorporating Named Entity,35.718475,139.73256
Unsupervised Bilingual Lexicon Induction via Latent Variable Models,37.98389,23.705557
Generating Video Descriptions With Latent Topic Guidance,-34.53947,-58.46463
Aspect based citation sentiment analysis using linguistic patterns for better comprehension of scientific knowledge,-6.988134,110.43562
Large Context End-to-end Automatic Speech Recognition via Extension of Hierarchical Recurrent Encoder-decoder Models,42.30105,-87.85776
A syllable-based approach for improved recognition of spoken names,36.81333,-119.75
Better Word Embeddings by Disentangling Contextual n-Gram Information,40.448128,-3.722359
Incorporating Context into Language Encoding Models for fMRI,19.031488,-98.315346
Direct Acoustics-to-Word Models for English Conversational Speech Recognition,10.4104,-66.8812
Hierarchical Character-Word Models for Language Identification,-43.644444,172.46861
One for All: Towards Language Independent Named Entity Linking,54.327137,10.180141
GANs for Semi-Supervised Opinion Spam Detection,-27.166468,-51.517834
M-BERT: Injecting Multimodal Information in the BERT Structure,-23.564201,-46.637978
Learning to Answer by Learning to Ask: Getting the Best of GPT-2 and BERT Worlds.,51.656326,39.20586
Evaluating Commonsense in Pre-Trained Language Models,24.439888,118.09043
Structured pruning of recurrent neural networks through neuron selection,-24.666668,25.933332
Improving Zero-Shot Translation of Low-Resource Languages,-31.9683,115.8151
Generating Diverse and Consistent QA pairs from Contexts with Information-Maximizing Hierarchical Conditional VAEs,48.184723,11.6125
KLEJ: Comprehensive Benchmark for Polish Language Understanding,-33.919724,150.93028
When Low Resource NLP Meets Unsupervised Language Model: Meta-Pretraining then Meta-Learning for Few-Shot Text Classification (Student Abstract),36.388718,127.3598
Speech to Semantics: Improve ASR and NLU Jointly via All-Neural Interfaces,55.002,-1.594
JAKET: Joint Pre-training of Knowledge Graph and Language Understanding,22.600597,88.42008
Attention Flows: Analyzing and Comparing Attention Mechanisms in Language Models,38.77503,-90.38622
Contrastive Distillation on Intermediate Representations for Language Model Compression,56.290146,43.929794
Exploring Versatile Generative Language Model Via Parameter-Efficient Transfer Learning,35.837547,10.607047
"Parsing with Multilingual BERT, a Small Corpus, and a Small Treebank",29.378082,71.75804
Blank Language Models,-10.908148,-37.05382
Interpretation of NLP models through input marginalization,-6.780556,39.203335
Enhancing Clinical BERT Embedding using a Biomedical Knowledge Base,6.247985,7.115192
Probing the Probing Paradigm: Does Probing Accuracy Entail Task Relevance?,31.166246,121.42178
Traceability Transformed: Generating More Accurate Links with Pre-Trained BERT Models,23.89777,121.541794
Evaluation of BERT and ALBERT Sentence Embedding Performance on Downstream NLP Tasks,45.503532,-73.62144
UNKs Everywhere: Adapting Multilingual Language Models to New Scripts.,33.792778,-117.85139
Language models can learn complex molecular distributions,-21.121557,-44.251602
Modeling Systematic Variations in Pronunciation via a Language-Dependent Hidden Speaking Mode,-35.28346,149.06496
New Swarm Intelligence Technique of Artificial Social Cockroaches for Suspicious Person Detection Using N-Gram Pixel with Visual Result Mining,47.556225,7.577304
N-gram based statistical grammar checker for Bangla and English,-35.4054,-71.6331
Selection criteria for word trigger pairs in language modeling,42.90878,129.49237
CLEF2006 Question Answering Experiments at Tokyo Institute of Technology,-23.186289,-45.88019
Malware Detection Based on Structural and Behavioural Features of API Calls,52.627457,-1.135057
Augmented state space acoustic decoding for modeling local variability in speech,42.357445,-83.10061
Speech recognition error correction using maximum entropy language model,53.21355,50.17572
The Use of a Structural N-gram Language Model in Generation-Heavy Hybrid Machine Translation,41.64131,26.616322
Phrase-based language models for speech recognition.,43.1178,131.8931
A Unified Deep Neural Network for Speaker and Language Recognition,50.73022,7.069667
Inferential language models for information retrieval,-36.86056,174.76994
Language model verbalization for automatic speech recognition,1.32081,103.84613
The energy exchanges between molecules,42.86126,-112.43429
A Systematic Comparison of Data Selection Criteria for SMT Domain Adaptation,38.748264,-9.165159
A hybrid post-processing system for offline handwritten Chinese script recognition,39.636433,118.17806
Improved acoustic modeling for speaker independent large vocabulary continuous speech recognition,51.497,-2.594
Variable-length categoryn-gram language models,41.493057,13.828611
Hierarchical Pitman-Yor language models for ASR in meetings,28.516459,77.24981
Cross-language headline generation for Hindi,53.423058,14.554167
The RWTH Large Vocabulary Arabic Handwriting Recognition System,-37.5761,143.846
A computerized technique to assess language use patterns in patients with frontotemporal dementia,39.948025,116.3521
Bit-strings and other modifications of Viviane model for language competition,52.516293,13.324989
Continuous speech recognition using PLP analysis with multilayer perceptrons,38.894955,-77.02325
Network model of human language,54.56965,-1.235446
Balancing error and supervision effort in interactive-predictive handwriting recognition,26.587599,106.72162
A comparative study on methods of Weighted language model training for reranking lvcsr N-best hypotheses,41.406307,2.194659
Integrating natural language constraints into HMM-based speech recognition,34.043,-118.69605
Use of Anti-Models to Further Improve State-of-the-Art PRLM Language Recognition System,39.00388,-77.10013
Balancing acoustic and linguistic probabilities,43.718376,10.424663
Multi-style language model for web scale information retrieval,48.705402,2.132565
A Robust Passage Retrieval Algorithm for Video Question Answering,46.498306,11.350309
Single-channel speech separation and recognition using loopy belief propagation,37.402718,-122.147995
Unsupervised Language Model Adaptation Incorporating Named Entity Information,51.517124,-0.114578
n-gram-based approach to composer recognition,49.414585,8.67295
Using model-theoretic semantic interpretation to guide statistical parsing and word recognition in a spoken language interface,35.632977,139.6358
Improved models for Mandarin speech-to-text transcription,40.348824,-74.60218
Towards mixed language speech recognition systems,52.10097,11.617556
Grounded Language Modeling for Automatic Speech Recognition of Sports Video,53.166668,8.65
An automatic technique to include grammatical and morphological information in a trigram-based statistical language model,45.477184,9.230385
A Statistical Based Part of Speech Tagger for Urdu Language,37.94154,23.65298
Efficient sentence segmentation using syntactic features,26.177279,32.73717
Modeling prosody for language identification on read and spontaneous speech,51.49701,-0.136949
Unified stochastic engine (USE) for speech recognition,42.31812,-72.63814
Discriminative Classifiers for Language Recognition,-26.8422,-65.2313
Joint Morphological-Lexical Language Modeling for Processing Morphologically Rich Languages With Application to Dialectal Arabic,51.417778,6.886389
Automatic handwriting gestures recognition using hidden Markov models,49.893845,10.886044
The ESAT 2008 system for N-Best Dutch speech recognition benchmark,34.21204,108.94842
Towards multilingual speech recognition using data driven source/target acoustical units association,23.9928,121.59127
Unsupervised Modeling of Signs Embedded in Continuous Sentences,40.389217,-74.76196
Adaptive categorical understanding for spoken dialogue systems,47.16833,27.584723
The Utility of Cognitive Plausibility in Language Acquisition Modeling: Evidence From Word Segmentation,40.7142,31.5128
Efficient Collapsed Gibbs Sampling For Latent Dirichlet Allocation,40.740158,-73.98338
Making Latin Manuscripts Searchable using gHMM's,-22.21643,-54.814926
Obtaining language models of web collections using query-based sampling techniques,42.649986,-73.76029
An HMM-based artificial bandwidth extension evaluated by cross-language training and test,43.222046,76.92252
The 1997 CMU Sphinx-3 English Broadcast News Transcription System,40.04426,116.34168
N-gram: a language independent approach to IR and NLP,40.838448,14.182806
Word Topical Mixture Models for Dynamic Language Model Adaptation,25.262356,82.98936
Exact training of a neural syntactic language model,41.7547,-72.6811
Factored Language Models Tutorial,31.049992,121.7881
Acquired severe aplastic anemia: progress and perplexity,29.53007,106.56923
Mining Words in the Minds of Second Language Learners: Learner-Specific Word Difficulty,48.877453,2.172622
Converting Continuous-Space Language Models into N-Gram Language Models for Statistical Machine Translation,35.91219,128.80775
Cross-lingual transfer learning during supervised training in low resource scenarios,38.1214,15.662562
Integrating recognition confidence scoring with language understanding and dialogue modeling,13.486286,2.13099
Temporal Attention Model for Neural Machine Translation.,39.885647,116.39389
Entity Extraction for Malayalam Social Media Text Using Structured Skip-gram Based Embedding Features from Unlabeled Data,22.556187,114.05246
Time-Aware Click Model,35.68912,140.02135
Gram-CTC: Automatic Unit Selection and Target Decomposition for Sequence Labelling,48.866955,2.355421
N-gram Language Modeling using Recurrent Neural Network Estimation,31.098333,30.95
A Perplexity-Based Method for Similar Languages Discrimination,42.465973,-2.426219
Low-Rank RNN Adaptation for Context-Aware Language Modeling,30.359724,76.45423
Multilingual Bottleneck Features for Subword Modeling in Zero-resource Languages,40.805717,-73.96117
Neural Machine Translation of Indian Languages,10.727388,79.02333
Dank Learning: Generating Memes Using Deep Neural Networks,42.41524,-71.07729
Scalable Query N-Gram Embedding for Improving Matching and Relevance in Sponsored Search,23.164244,112.89752
Leveraging Native Language Information for Improved Accented Speech Recognition,51.754345,-1.209313
Session-level Language Modeling for Conversational Speech,55.647552,37.5106
Knowledge Distillation for Recurrent Neural Network Language Modeling with Trust Regularization,29.960226,-90.081726
Unsupervised Multilingual Word Embedding with Limited Resources using Neural Language Models,33.56047,-117.13372
Prepositional Phrase Attachment through a Backed-Off Model,24.986992,121.57522
Communication-Efficient Learning of Deep Networks from Decentralized Data,4.952488,8.340628
Shared-Private Bilingual Word Embeddings for Neural Machine Translation,-6.305992,106.75441
"BERT Post-Training for Review Reading Comprehension and Aspect-based
  Sentiment Analysis",39.105743,117.18457
"Hello, It's GPT-2 -- How Can I Help You? Towards the Use of Pretrained Language Models for Task-Oriented Dialogue Systems",17.4928,78.1378
Local Monotonic Attention Mechanism for End-to-End Speech And Language Processing,-37.919792,145.12244
Factorization tricks for LSTM networks,36.90419,127.24546
Natural Language Processing with Small Feed-Forward Networks,36.587296,-82.1591
Unwritten languages demand attention too! Word discovery with encoder-decoder models,51.4594,-2.596
Neural Lattice Language Models,23.001951,120.219635
Natural Language Generation in Dialogue using Lexicalized and Delexicalized Data,44.22889,-76.46861
Hierarchical Representation in Neural Language Models: Suppression and Recovery of Expectations,26.565596,31.707758
A Transformer-Based Variational Autoencoder for Sentence Generation,40.80478,-73.93407
Deep Reinforcement Learning For Modeling Chit-Chat Dialog With Discrete Attributes,31.460749,74.24363
GEM: Generative Enhanced Model for adversarial attacks,36.38282,54.919857
Language Features Matter: Effective Language Representations for Vision-Language Tasks,23.125832,113.287254
Trajectory-based recognition of dynamic Persian sign language using hidden Markov model,-5.203306,-37.32516
Black Hole Entropy: A Closer Look,41.82283,12.672068
Tree-Structured Attention with Hierarchical Accumulation,37.387806,117.98684
Explicit Sparse Transformer: Concentrated Attention Through Explicit Selection,14.075937,100.61713
Semi-Supervised Speech Recognition via Local Prior Matching,-23.681,-70.41
BAE: BERT-based Adversarial Examples for Text Classification,39.923725,116.33644
Joint Contextual Modeling for ASR Correction and Language Understanding,43.61601,-84.24994
Improving the Performance of Transformer Based Low Resource Speech Recognition for Indian Languages,16.06044,108.20962
DIET: Lightweight Language Understanding for Dialogue Systems,49.2612,-123.123055
VD-BERT: A Unified Vision and Dialog Transformer with BERT,24.759645,46.8604
Probabilistically Masked Language Model Capable of Autoregressive Generation in Arbitrary Word Order,51.320557,12.394444
Effective Estimation of Deep Generative Language Models,20.2592,85.792
Translationese as a Language in ¡°Multilingual¡± NMT,5.405278,103.087776
FinBERT: A Pretrained Language Model for Financial Communications,-35.28189,149.12157
Cyberbullying Detection using Pre-Trained BERT Model,33.549175,119.0361
Optical character recognition with neural networks and post-correction with finite state methods,22.904068,113.87499
Advances in subword-based HMM-DNN speech recognition across languages,50.10571,14.391517
An Ensemble of Generation- and Retrieval-Based Image Captioning With Dual Generator Generative Adversarial Network,50.877792,4.694661
SpeechBERT: An Audio-and-Text Jointly Learned Language Model for End-to-End Spoken Question Answering,26.865557,80.936386
A Semi-supervised Approach to Generate the Code-Mixed Text using Pre-trained Encoder and Transfer Learning,55.84317,-4.42859
Deep context modeling for multi-turn response selection in dialogue systems,-7.55691,110.77169
BioBERTpt - A Portuguese Neural Language Model for Clinical Named Entity Recognition,29.961159,-90.145775
Authorship Attribution for Neural Text Generation,34.378548,108.98835
Hierarchical Visual-Textual Graph for Temporal Activity Localization via Language,36.65561,136.64606
UNQOVERing Stereotyping Biases via Underspecified Questions,51.52401,-0.132965
Learning from past mistakes: improving automatic speech recognition output via noisy-clean phrase context modeling,38.637,-90.265
XHate-999: Analyzing and Detecting Abusive Language Across Domains and Languages,45.7807,4.874479
Specializing Unsupervised Pretraining Models for Word-Level Semantic Similarity,28.219059,112.94492
Rethinking Embedding Coupling in Pre-trained Language Models,36.38779,127.3723
BOLD,51.421757,-0.226045
PanGu-¦Á: Large-scale Autoregressive Pretrained Chinese Language Models with Auto-parallel Computation.,13.819555,100.51481
ProteinBERT: A universal deep-learning model of protein sequence and function,36.461727,140.59941
Synthesizer: Rethinking Self-Attention for Transformer Models,35.529907,24.06847
Large-scale Discriminative n-gram Language Models for Statistical Machine Translation.,-4.008539,122.52236
Fine-Tuning Pre-trained Language Model with Weak Supervision: A Contrastive-Regularized Self-Training Approach,26.07858,119.30446
VLN?BERT: A Recurrent Vision-and-Language BERT for Navigation,48.719166,21.25111
CPM: A large-scale generative Chinese Pre-trained language model,35.68716,139.74039
Wittgenstein on Freud and Frazer,37.16512,28.372889
The lived experience of psychosis: a bottom©\up review co©\written by experts by experience and academics,43.70006,5.739412
Model-based feedback in the language modeling approach to information retrieval,32.875553,-117.232445
Feature-Rich Language-Independent Syntax-Based Alignment for Statistical Machine Translation,23.4135,85.439766
Socratic Perplexity and the Nature of Philosophy,44.318893,23.80069
Discovering Factions in the Computational Linguistics Community,56.323532,44.022213
Integration of parsing and incremental speech recognition,36.469,127.14
Statistical Substring Reduction in Linear Time,-33.285915,149.10579
From broadcast news to spontaneous dialogue transcription: portability issues,45.392933,-75.66221
Using a connectionist model in a syntactical based language model,20.591566,-100.41066
Adaptation of Statistical Machine Translation Model for Cross-Lingual Information Retrieval in a Service Context,48.01747,0.160873
Continuous speech recognition results of the BYBLOS system on the DARPA 1000-word resource management database,56.55296,-2.618073
Confidence metrics based on n-gram language model backoff behaviors,39.95108,-75.19554
Author Identification using Multi-headed Recurrent Neural Networks,37.517143,121.35853
N-gram-based statistical machine translation versus syntax augmented machine translation,21.161318,72.78535
Integration of multiple acoustic and language models for improved Hindi speech recognition system,39.181824,-76.80313
A block organized model builder,-21.762709,-41.285027
Flexible use of semantic constraints in speech recognition,32.772163,-117.189064
Multilingual a-stabil: A new confidence score for multilingual unsupervised training,50.630585,3.074649
Jane: an advanced freely available hierarchical machine translation toolkit,47.248215,5.991323
A General Technique to Train Language Models on Language Models,41.087646,121.1186
Accelerating recurrent neural network training via two stage classes and parallelization,51.551575,-0.110687
Exploiting language models to recognize unseen actions,45.19794,5.771995
Acoustic and lexical resource constrained ASR using language-independent acoustic model and language-dependent probabilistic lexical model,40.041878,116.41486
Japanese large-vocabulary continuous-speech recognition using a newspaper corpus and broadcast news,39.751183,30.59086
The RWTH Arabic-to-English spoken language translation system,39.1273,117.17436
Modeling Multi-query Retrieval Tasks Using Density Matrix Transformation,38.20972,48.299168
Humor theory and the fear of being laughed at,45.700478,126.620224
