name,latitude,longitude
Chinese Named Entity Recognition in the Geoscience Domain Based on BERT,45.06316,7.660711
Improving Mandarin End-to-End Speech Recognition With Word N-Gram Language Model,38.991146,-76.943665
Term-specific smoothing for the language modeling approach to information retrieval,30.481773,114.32268
AP-BERT: enhanced pre-trained model through average pooling,47.31331,5.072819
ETEH: Unified Attention-Based End-to-End ASR and KWS Architecture,5.53265,-73.364685
Delta Tuning: A Comprehensive Study of Parameter Efficient Methods for Pre-trained Language Models,52.42849,13.534479
End-to-End Transformer Based Model for Image Captioning,41.78521,-73.73385
BioBART: Pretraining and Evaluation of A Biomedical Generative Language Model,43.833122,87.62772
Adversarial Mask Transformer for Sequential Learning,30.581451,114.29573
TaleBrush: Sketching Stories with Generative Pretrained Language Models,37.954876,112.5294
Efficient Adapter Transfer of Self-Supervised Speech Models for Automatic Speech Recognition,35.421818,137.14525
Training Compute-Optimal Large Language Models,33.68274,44.6073
Prediction of RNA¨Cprotein interactions using a nucleotide language model,37.775047,-122.42696
Vision-Language Transformer for Interpretable Pathology Visual Question Answering,51.44297,5.469018
SLUE: New Benchmark Tasks For Spoken Language Understanding Evaluation on Natural Speech,47.044487,15.479626
Transfer Learning Approaches for Building Cross-Language Dense Retrieval Models,31.221947,121.4147
"Scaling Language Models: Methods, Analysis & Insights from Training
  Gopher",21.480368,83.8837
An Exploration of Prompt Tuning on Generative Spoken Language Model for Speech Processing Tasks,44.46178,-93.183655
Investigation of improving the pre-training and fine-tuning of BERT model for biomedical relation extraction,45.530167,10.936304
ERNIE-GeoL: A Geography-and-Language Pre-trained Model and its Applications in Baidu Maps,37.460644,-122.04138
Prediction of Linear Cationic Antimicrobial Peptides Active against Gram-Negative and Gram-Positive Bacteria Based on Machine Learning Models,29.848616,31.336723
Multi-Task Language Modeling for Improving Speech Recognition of Rare Words,51.39734,0.53747
LMPred: predicting antimicrobial peptides using pre-trained language models and deep learning,1.297461,103.7803
Human Language Understanding &amp; Reasoning,34.708008,135.6438
OPT: Open Pre-trained Transformer Language Models,40.376812,-82.39624
From Bag-of-Words to Pre-trained Neural Language Models: Improving Automatic Classification of App Reviews for Requirements Engineering,56.0474,14.14638
A Higher-Order N-gram Model to Enhance Automatic Word Prediction for Assamese Sentences Containing Ambiguous Words,55.65988,37.646015
Perplexity,30.423811,-97.74795
Rejection strategies for offline handwritten sentence recognition,47.352757,8.573346
Moral Perplexity,35.413986,0.129604
Bayesian extension to the language model for ad hoc information retrieval,47.526352,19.032995
Sentiment Classification in Bengali News Comments using a hybrid approach with Glove,31.107084,121.60909
Webformer,48.7331,19.1455
Unsupervised Cross-lingual Representation Learning at Scale,39.72991,-89.619156
Reconstructing the cascade of language processing in the brain using the internal computations of a transformer-based language model,43.681587,-92.96782
Bangla-BERT: Transformer-Based Efficient Model for Transfer Learning and Language Understanding,51.7476,-1.2764
HelixFold-Single: MSA-free Protein Structure Prediction by Using Protein Language Model as an Alternative,49.207703,16.590883
Language database construction method based on big data and deep learning,19.04426,72.91242
Predicting dementia from spontaneous speech using large language models,45.42088,-75.702965
VL-ADAPTER: Parameter-Efficient Transfer Learning for Vision-and-Language Tasks,50.704548,7.102966
Large Language Models Encode Clinical Knowledge,43.2569,5.40498
ChatGPT in Drug Discovery,25.521566,103.75111
COVID-Twitter-BERT: A natural language processing model to analyse COVID-19 content on Twitter,45.920834,6.159722
RATE-OF-SPEECH MODELING FOR LARGE VOCABULARY CONVERSATIONAL SPEECH RECOGNITION,27.26949,56.438625
On enhancing katz-smoothing based back-off language model,39.936928,116.42663
Perplexity and Ultimacy: Metaphysical Thoughts from the Middle,46.229393,6.134266
Language models for automatic speech recognition : construction and complexity control,43.646503,3.869094
Provocations: Sylvia Ashton-Warner and Excitability in Education,42.085278,-71.39889
Experimental evaluation of Italian language models for large-dictionary speech recognition.,55.748768,37.695663
Intellectual Property in the Global Trading System: EU-China Perspective,52.208126,20.983734
USING DEPENDENCY PATHS FOR ANSWERING DEFINITION QUESTIONS ON THE WEB,40.58549,-74.08524
N-gram Distributions in Texts as Proxy for Textual Fingerprints,35.685555,-117.69194
An intonation model for embedded devices based on natural F0 samples,43.19366,-77.58776
A new based distance language model for a dictation machine: application to MAUD,32.76143,35.019516
Demonstrative Astronomy: Notes On Levi Ben Gersom¡¯s Answer To Guide II.24,47.247475,-1.552634
Applying grammatical inference in learning a language model for oral dialogue,43.71579,7.26742
Recognized phoneme-based N-gram modeling in automatic language identification,40.819817,14.182885
Parallel Texts Extraction from Multimodal Comparable Corpora,28.929909,53.63248
Class-based variable memory length Markov model,23.14897,113.3581
Using Large N-gram for Vietnamese Spell Checking,51.5169,-0.237365
Perplexity analysis of obesity news coverage.,50.779205,4.351736
Word-Graph Based Applications for Handwriting Documents: Impact of Word-Graph Size on Their Performances,43.24033,5.438807
Multilingual Vandalism Detection Using Language-Independent & Ex Post Facto Evidence,18.93132,72.8332
An improved MAP method for language model adaptation,37.744568,115.66233
France Telecom R&D Beijing Word Segmenter for Sighan Bakeoff 2006,32.609505,44.00384
Text mining and probabilistic language modeling for online review spam detecting,47.365833,8.497778
An SMT-driven Authoring Tool,-7.932269,112.60014
Slovenian spontaneous speech recognition and acoustic modeling of filled pauses and onomatopoeas,10.996287,-74.7911
Getting more from automatic transcripts for semi-supervised language modeling,37.427628,-122.16701
Language modeling for spoken dialogue system based on sentence transformation and filtering using predicate-argument structures,34.780033,113.80636
Vocabulary Filtering for Term Weighting in Archived Question Search,35.974762,-78.88028
An Article Language Model for BBS Search,-2.999396,104.77055
On-the-fly Topic Adaptation for YouTube Video Transcription,-37.99721,-57.546314
Translation Model of Myanmar Phrases for Statistical Machine Translation,-42.784595,-65.00897
A Trigram Statistical Language Model Algorithm for Chinese Word Segmentation,-33.91724,151.23122
Improved strategies for a zero oov rate LVCSR system,40.6795,-74.2319
Effective Term Weighting for Sentence Retrieval,32.943493,74.95341
The Russian Language Text Corpus for Testing Algorithms of Topic Model,35.078243,136.90584
Statistical approaches for natural language modelling and monotone statistical machine translation,42.399967,25.571154
Correlation between Similarity Measures for Inter-Language Linked Wikipedia Articles,40.80614,111.67279
"Generation, Implementation and Appraisal of an N-gram based Stemming
  Algorithm",39.48076,-0.406416
A language model for compound words in speech recognition,41.062,-80.043
Extended multi-word trigger pair language model using data mining technique,43.636024,3.865557
Hindi-English speech-to-speech translation system for travel expressions,42.399876,-71.25806
Automatic Language Identification Using Phoneme and Automatically Derived Unit Strings,51.527367,-0.104267
Enhancing information retrieval through concept-based language modeling and semantic smoothing,43.040764,-89.35403
Better Language Models with Model Merging,55.569706,9.747144
An Approach for Improving Thai Text Entry on Touch Screen Mobile Phones Based on Distance and Statistical Language Model,45.783817,4.873281
Question Prediction Language Model,45.78389,4.868926
Building Language Models for Tamil Speech Recognition System,35.64574,139.40973
Combining Topic Specific Language Models,50.923065,6.366574
MUDOS-NG: Multi-document Summaries Using N-gram Graphs (Tech Report),28.421907,77.52579
A Semantics-Enhanced Language Model for Unsupervised Word Sense Disambiguation,36.36939,127.36402
An Information Retrieval Model Based on Semantics,38.75825,-93.73954
A Pragmatic Chinese Word Segmentation System,6.89417,3.71863
Easing Erroneous Translations in Cross-Language Image Retrieval Using Word Associations,-7.193848,107.881676
Towards the exploitation of statistical language models for plagiarism detection with reference,36.801357,5.751528
Domain N-Gram Construction and Its Application to Text Editor,30.859432,41.198986
UBY-LMF - Exploring the Boundaries of Language-Independent Lexicon Models,44.533203,-87.921524
Automatic dialogue acts classification in Slovak dialogues,55.70084,12.593066
Speech recognition applied to reading assistance for children: a baseline language model,48.837307,7.799991
Highly-Inflected Language Generation Using Factored Language Models,48.827263,2.382753
Turkish dictation sytem for broadcast news applications,36.843716,10.196716
Sentence Compression in Spanish driven by Discourse Segmentation and Language Models,48.3957,11.7304
Phonotactic spoken language identification with limited training data,0.762747,127.336266
Block-Based Language Modeling Approach Towards Web Search,42.653206,-73.776276
Transducer-based speech recognition with dynamic language models,50.46251,30.651417
N-gram based text classification for Persian newspaper corpus,47.838608,1.945258
Effectiveness of the backoff hierarchical class n-gram language models to model unseen events in speech recognition,43.661503,10.628533
Development of SRI¡¯s 1997 Broadcast News Transcription System,41.506046,-81.60869
Crowd-supervised training of spoken language systems,42.28184,-89.66837
Multi-lingual Indexing Support for CLIR using Language Modeling.,43.696373,7.306743
Language identification using vector quantization,40.58453,-105.05754
Low-frequency word enhancement with similar pairs in speech recognition,55.480186,-4.575773
Psychic Costs and Factor Price Equalization,36.668724,117.04772
Integration of Multiple Bilingually-Learned Segmentation Schemes into Statistical Machine Translation,14.079378,100.603806
A grammatical approach to reducing the statistical sparsity of language models in natural domains,23.204847,77.452324
Character-Based Handwritten Text Recognition of Multilingual Documents,46.10938,7.08444
Due Process and the Introduction of New Technology: The Institution of Video Teleconferencing,28.199621,112.86939
Improvements on transducing syllable lattice to word lattice for keyword search,33.794724,-79.011665
Using context-dependent interpolation to combine statistical language and translation models for interactive machine translation,43.668,-79.39496
Effects of language modeling on speech-driven question answering,42.67262,23.366322
Implementing a Domain-specific Language for Model-based Drug Development,37.867016,138.94252
LDA-based LM adaptation using latent semantic marginals and minimum discriminant information,59.348366,18.069471
Search Using N-gram Technique Based Statistical Analysis for Knowledge Extraction in Case Based Reasoning Systems,-35.343464,149.1585
Adapting language models for frequent fixed phrases by emphasizing n-gram subsets,-25.493353,-54.563255
DalTREC 2005 Spam Track: Spam Filtering using N-gram-based Techniques,25.019526,121.40098
JHU System Combination Scheme for WMT 2010,30.976194,104.282394
Improved Extraction Assessment through Better Language Models,30.914248,75.82428
SPONTANEOUS SPEECH RECOGNITION FOR ROMANIAN IN SPOKEN DIALOGUE SYSTEMS,47.263317,11.387461
Syntactic and Semantic Disambiguation of Numeral Strings Using an N-Gram Method,44.848713,11.060123
Mining of association patterns for language modeling,48.143257,11.548181
Discriminative training of n-gram classifiers for speech and text routing,45.459183,9.195342
A Novel Approach for Treating Uncertain Rule-based Knowledge Conflicts,-7.021314,110.461876
Automatic speech recognition for polish in a computer game interface,36.628296,127.45829
Online adaptive learning for speech recognition decoding,38.98597,-77.09043
An Empirical Evaluation of Stop Word Removal in Statistical Machine Translation,42.353546,-71.06104
Evaluating Parsing Schemes with Entropy Indicators.,34.085983,74.79879
"DCU@FIRE2010: Term Conflation, Blind Relevance Feedback, and Cross-Language IR with Manual and Automatic Query Translation",40.659267,-111.8918
Multi-Span statistical language modeling for large vocabulary speech recognition,32.833565,-117.27501
Integrating detailed information into a language model,25.293976,51.50281
Hybrid speech recognition system with discriminative training applied for Romanian language,48.881706,2.358421
A non-learning approach to spelling correction in web queries,53.42911,14.564136
Contextual Information and Specific Language Models for Spoken Language Understanding,47.71112,40.20668
Triggering individual word domains in n-gram language models,38.67411,-90.39671
Use of the Derin's algorithm in hidden semi-Markov models for automatic speech recognition,34.93889,-81.030556
Multiple text segmentation for statistical language modeling,40.47619,-3.692927
Combined models for topic spotting and topic-dependent language modeling,27.683939,84.43582
Phrase language models for detection and verification-based speech understanding,34.657887,135.21494
Learning to bridge colloquial and formal language applied to linking and search of E-Commerce data,54.721443,55.943977
A syllable-scale framework for language identification,37.601284,127.13237
Multilingual probabilistic topic modeling and its applications in web mining and search,39.94302,116.28591
THE DESIGN AND TESTING OF A FIRST-ORDER LOGIC-BASED STOCHASTIC MODELING LANGUAGE,17.31295,76.87425
Training candidate selection for effective rejection in open-set language identification,34.75988,113.69638
Intuitive Topic Discovery by Incorporating Word-Pair's Connection Into LDA,51.280804,-0.791673
Comparison of information retrieval models for question answering,52.530796,13.382415
Recent topics in speech recognition research at NTT laboratories,35.760372,50.91988
Language recognition system using language branch discriminative information,26.20301,78.194374
A NEURAL NETWORK MODEL FOR THE SIMULATION OF WORD PRODUCTION ERRORS OF FINNISH NOUNS,31.957087,35.94578
Introduction to probabilistic models in IR,-32.058075,115.751686
Finding Our Way in Perplexity: The Meanings of Sex in the Analysis of a Gay Man,44.40544,8.942674
Probabilistic lexical modeling and unsupervised training for zero-resourced ASR,29.766308,-95.35916
Flexible speech act based dialogue management,52.13232,-106.64151
Cross-lingual text classification with model translation and document translation,-19.885101,-43.917797
Improved recognition of Hungarian call center conversations,35.679222,139.78668
Multi-view features in a DNN-CRF model for improved sentence unit detection on English broadcast news,35.813934,127.08958
Automatic speaker and language recognition,-39.813988,-73.247894
A HYBRID LANGUAGE MODEL BASED ON STATISTICS AND LINGUISTIC RULES,45.764072,3.112276
Filtering artificial texts with statistical machine learning techniques,39.08051,-77.23398
Translating EXPRESS language model into C language model,35.072,-78.8945
Peking and Indochina: The Perplexity of Victory,7.762731,4.60126
Good Ol¡¯ Boy Talk versus the Blogosphere in the Case of Former Senator George Allen,37.542732,126.683784
Generating sentence from motion by using large-scale and high-order N-grams,32.054943,118.764946
A comparison of rule-based and statistical methods for semantic language modeling and confidence measurement,-0.875798,100.38096
Learning to recommend questions based on public interest,37.544098,126.94755
Phonotactic language recognition based on DNN-HMM acoustic model,22.6042,120.39
Web Catchphrase Improve System Employing Onomatopoeia and Large-Scale N-gram Corpus,45.7826,21.215443
Language identification in code-switching speech using word-based lexical model,-6.7716,39.237347
Japanese OCR Error Correction Using Stochastic Morphological Analyzer and Probabilistic Word N-gram Model,22.912697,57.67187
Randomized maximum entropy language models,39.745796,-105.007515
The Adaptation Schemes In PR-SVM Based Language Recognition,51.50981,-0.141014
Speaker adaptation by variable reference model subspace and application to large vocabulary speech recognition,40.44204,-3.69962
A Topic Model of Observing Chinese Characters,48.435246,35.046494
Hamlet: a prototype of a voice-activated typewriter,38.848213,-76.98813
Parts of Speech Tagging for Afaan Oromo,51.53845,46.007668
Extracting N-gram terms collocation from tagged Arabic corpus,52.05731,4.264889
Domain-specific model transformation in building quantity take-off,23.734707,92.66489
Cross-language spoken document retrieval using HMM-based retrieval model with multi-scale fusion,27.484089,-109.933846
A Context-free Grammar-based Language Model for String Recognition,44.805004,10.308548
Using data mining techniques and rough set theory for language modeling,31.28917,121.48828
Solving English Questions through Applying Collective Intelligence,36.99532,35.31463
Refining generative language models using discriminative learning,35.94027,-83.94502
A syntactic time-series model for parsing fluent and disfluent speech,42.366146,14.152241
Language Model Adaptation Based on PLSA of Topics and Speakers for Automatic Transcription of Panel Discussions,49.552586,25.590464
A fusion approach to spoken language identification based on combining multiple phone recognizers and speech attribute detectors,23.210783,77.445984
Wolof Speech Recognition Model of Digits and Limited-Vocabulary Based on HMM and ToolKit,33.769753,113.18903
Using the Gram-Charlier expansion in power systems reliability,49.11926,6.16794
Modelling text prediction systems in low- and high-inflected languages,53.753387,-1.815305
Robust optimal control of regular languages,34.06972,72.64389
The Comparation of Distance-Based Similarity Measure to Detection of Plagiarism in Indonesian Text,48.15524,-1.827429
3D visual pronunciation of Mandarine Chinese for language learning,42.381668,-71.12852
Large vocabulary hidden markov model based speech recognition,-7.122164,112.42211
The Teacher¡¯s World: Heideggerian Authenticity and Existential Thinking in Initial Teacher Education,39.982567,116.42218
Post-dialogue confidence scoring for unsupervised statistical language model training,35.00992,135.72653
Keyword and keyphrase extraction from single Hindi document using statistical approach,45.65806,13.829176
Joint n-gram Chinese language modeling with an application to Chinese word segmentation,45.046753,38.92589
Can You Seek The Answer To This Question?,48.198193,11.601917
Automated natural language headline generation using discriminative machine learning models,37.377533,-121.97872
A dynamic language model based on individual word domains,43.61541,7.0674
Behavior extraction from tweets using character N-gram models,55.923733,-3.187859
Evaluation of smoothing techniques for language modeling in automatic filipino speech recognition,8.958331,7.167685
Cooperative model based language understanding in dialogue,46.997566,6.94749
Significance of the Characteristic Chemical Pattern of Gram Positive and Gram Negative Bacterial Cell Walls,40.91634,29.173243
Language model adaptation using Random Forests,49.899857,2.300455
Improvement in Performance of Tamil Phoneme Recognition using Variable Length and Hybrid Language Models,8.523974,76.928375
Design and evaluation of acoustic and language models for large scale telephone services,35.050655,-106.54314
Statistical phrase alignment model using dependency relation probability,39.823574,116.14708
Incorporating Linguistic Model Adaptation into Whole-Book Recognition,39.974533,116.484566
An Empirical Study of Good-Turing Smoothing for Language Models on Different Size Corpora of Chinese,-7.281058,112.74466
Dictionary organizations for efficient similarity retrieval,56.32639,44.025276
Reflective thought in memos to demonstrate advanced nursing practice in New Zealand,48.79699,2.282396
DARPA February 1992 pilot corpus CSR "dry run" benchmark test results,37.870117,-122.27137
A study on Hakka and mixed Hakka-Mandarin speech recognition,23.13467,113.36269
English and Taiwanese text categorization using N-gram based on Vector Space Model,30.79315,106.086296
Hybrid grammar-bigram speech recognition system with first-order dependence model,9.052035,-79.62272
An extended clustering algorithm for statistical language models,28.629,77.245865
Predicting Phrase Breaks in Classical and Modern Standard Arabic Text,29.713617,118.290306
Unsupervised acoustic model training for the Korean language,56.8328,60.576466
Optimizing ranking method using social annotations based on language model,-22.515137,-44.10688
Using Built-In Domain-Specific Modeling Support to Guide Model-Based Test Generation,42.99923,141.39482
Happiness as a scientific category,32.05296,118.76268
Could n-gram analysis contribute to genomic island determination?,53.791485,-2.708945
Aging as a Social Form: The Phenomenology of the Passage,-34.078167,150.80573
Rank aggregation of dispersion measure orderings for estimating Gaussian mixture model language recognition performance,55.488102,37.295296
Temporal kernel neural network language model,48.764256,2.173554
On-line adaptation of semantic models for spoken language understanding,40.44329,-3.684507
Optical character recognition of handwritten Arabic using hidden Markov models,18.396816,-66.157
"A convenient, economical and scalable multi-gram synthesis of 1-vinylcyclopropyl 4-methylbenzenesulfonate",49.10316,6.221132
Automatic spoken language identification utilizing acoustic and phonetic speech information,13.134609,-59.62983
Discovering Hierarchical Patterns of Students' Learning Behavior in Intelligent Tutoring Systems,45.350967,-75.939835
Tag line generating system using knowledge extracted from statistical analyses,48.11667,-1.639856
Filled Pause Refinement Based on the Pronunciation Probability for Lecture Speech,50.747025,25.330803
Automatic learning of structural language models,30.165413,66.990524
Detecting Emotive Sentences with Pattern-based Language Modelling,35.877754,139.78992
The Perplexity of Our Time: Rabbi Nachman Krochmal and Modern Jewish Existence,41.584904,-72.71999
"Language models, probability of relevance and relevance likelihood",35.271854,115.465904
Pipelined language model construction for Polish speech recognition,-7.747087,110.35531
Unknown Word Recognition Based on Maximal Cliques,45.447075,-75.62348
Continuous Speech Recognition system for Tamil language using monophone-based Hidden Markov Model,35.654484,139.71797
Improving dialogue systems in a home automation environment,34.30327,48.814487
Automatic composition system using genetic algorithm and N-gram model - influence of N in N-gram model,13.090017,80.2787
The Life and Works of a Bottom©\Up Thinker,50.26655,-5.094309
Construction and evaluation of language models based on stochastic context-free grammar for speech recognition,37.50385,15.076638
Information retrieval and spelling correction,25.059336,102.702576
Spanish phone recognition using semicontinuous hidden Markov models,48.842205,2.345172
An alternative to head-driven approaches for parsing a (relatively) free word-order language,50.816406,4.274133
N©\best breadth search for large vocabulary continuous speech recognition using a long span language model,51.801994,19.436178
USING DATA-DRIVEN SUBWORD UNITS IN LANGUAGE MODEL OF HIGHLY INFLECTIVE SLOVENIAN LANGUAGE,35.75605,51.35651
A hybrid computational model for spoken language understanding,55.7108,37.577812
Using smoothed K-TSS language models in continuous speech recognition,-31.634815,-60.67054
Continuous Distributed Representations of Words as Input of LSTM Network Language Model,32.645077,117.01909
Efficient language model look-ahead probabilities generation using lower order LM look-ahead information,54.013012,12.227809
A second language acquisition model using example generalization and concept categories,9.927849,78.136826
Chunking and Extracting Text Content for Mobile Learning: A Query-Focused Summarizer Based on Relevance Language Model,6.296514,-75.569405
Language recognition by means of ergodic hidden Markov models,49.61902,6.100791
Development and evaluation of the ATOS spontaneous speech conversational system,37.088028,140.5055
A stochastic language model for speech recognition integrating local and global constraints,4.698809,-74.186226
q-gram matching using tree models,44.80361,20.508
Efficient combination of n-gram language models and recognition grammars in real-time LVCSR decoder,45.73658,4.92546
A flexible stand-off data model with query language for multi-level annotation,11.005666,76.9189
Improvement of non-negative matrix factorization based language model using exponential models,34.79099,113.680885
Indonesian automatic speech recognition system using English-based acoustic model,39.9267,116.45455
Acoustic Model Adaptation Based on Pronunciation Variability Analysis for Non-Native Speech Recognition,55.7108,37.577812
AN N-GRAM BASED APPROACH TO THE AUTOMATIC CLASSIFICATION OF WEB PAGES BY GENRE,37.586353,127.0028
Two-part segmentation of text documents,-23.544954,-46.637966
JHU/APL at TREC 2004: Robust and Terabyte Tracks.,52.100246,5.109056
Speech recognition of a named entity,13.038357,77.58413
